,Hot Sauce,Brand Name,Ingredients,Scoville Rating (SHU),# of Seasons,7-pot,adobo,aji,aka,amarillo,anaheim,ancho,apollo,arbol,bell,bhut jolokia,bird,calabrian,capsicum,carolina reaper,cayenne,cherry,chili,chipotle,chocolate bhutlah,datil,fatalli,fijian bongo,fresno,guajillo,habanero,hatari,jalapeno,jigsaw,manzano,pasilla,peach,pepperoncini,pepperx,piquin,primo,scorpion,scotch bonnet,serrano,sivathei,tabasco,tepin,with_chili,with_cayenne,with_habanero,totalpepperpersauce
0,13 Angry Scorpions Jekyll & Hyde Scorpion Chipotle Hot Sauce,13 Angry Scorpions,"Moruga Scorpion peppers, Smoked Chipotle peppers, apple cider vinegar, white vinegar, garlic, ginger, lemon juice, tomato paste, brown sugar, onion, mustard powder, paprica, sea salt",109000,1,0,0,0,0,0,0,0,0,0,0,0,0,0,0,0,0,0,0,1,0,0,0,0,0,0,0,0,0,0,0,0,0,0,0,0,0,1,0,0,0,0,0,0,0,0,2
1,Adoboloco Fiya! Fiya! Hot Sauce,Adoboloco,"Apple cider vinegar, jalapeno, dried Trinidad scorpion, habanero, ghost, sea salt, garlic ",77000,1,0,0,0,0,0,0,0,0,0,0,1,0,0,0,0,0,0,0,0,0,0,0,0,0,0,1,0,1,0,0,0,0,0,0,0,0,1,0,0,0,0,0,0,0,1,4
2,Adoboloco Hawaiian Hot Sauce Hamajang Kiawe Smoked Ghost Pepper,Adoboloco,"Apple Cider Vinegar, Ghost Peppers, Habanero, Sea Salt, Garlic",32000,1,0,0,0,0,0,0,0,0,0,0,1,0,0,0,0,0,0,0,0,0,0,0,0,0,0,1,0,0,0,0,0,0,0,0,0,0,0,0,0,0,0,0,0,0,1,2
3,Adoboloco Island Wings Hot Sauce,Adoboloco,"Pineapple, chili pepper, red wine vinegar, honey, onion powder, nutritional yeast, sea salt, mustard seed powder, spices",5500,1,0,0,0,0,0,0,0,0,0,0,0,0,0,0,0,0,0,1,0,0,0,0,0,0,0,0,0,0,0,0,0,0,0,0,0,0,0,0,0,0,0,0,1,0,0,1
4,Adoboloco Kolohe Kid Hot Sauce,Adoboloco,"Apple Cider Vinegar, Ghost Peppers, Sea Salt, Garlic",61000,1,0,0,0,0,0,0,0,0,0,0,1,0,0,0,0,0,0,0,0,0,0,0,0,0,0,0,0,0,0,0,0,0,0,0,0,0,0,0,0,0,0,0,0,0,0,1
5,Angry Goat Dreams of Calypso Hot Sauce,Angry Goat Pepper Co.,"Pineapple, Mango, Yellow Scotch Bonnets, Lime Juice, Distilled Vinegar, Prepared Yellow Mustard (distilled vinegar, #1 mustard seeds, salt, turmeric, and spices), Carrots, Yellow Bell Peppers, Cane Sugar, Sea Salt, Granulated Garlic, Allspice.",101000,1,0,0,0,0,0,0,0,0,0,1,0,0,0,0,0,0,0,0,0,0,0,0,0,0,0,0,0,0,0,0,0,0,0,0,0,0,0,1,0,0,0,0,0,0,0,2
6,Angry Goat Hippy Dippy Green Hot Sauce,Angry Goat Pepper Co.,"Fire Roasted Jalapeno Peppers, Fire Roasted Serrano Peppers, Water, Lime Juice, Fire Roasted Tomatillos, Kiwi Fruit, Agave Nectar, Avocado, Tequila, Olive Oil, Granulated Garlic, Sea Salt, Onion Powder, Cumin, Black Pepper, Fresh Cilantro.",2300,1,0,0,0,0,0,0,0,0,0,0,0,0,0,0,0,0,0,0,0,0,0,0,0,0,0,0,0,1,0,0,0,0,0,0,0,0,0,0,1,0,0,0,0,0,0,2
7,Angry Goat Pepper Co. Goat Rider Hot Sauce,Angry Goat Pepper Co.,"Balsamic Vinegar (wine vinegar, concentrated grape must, caramel color), Cayenne Pepper Mash (cayenne peppers, salt), Vermont Maple Syrup, Roasted Red Pepper (roasted red bell peppers, water, citric acid & salt), Molasses, Garlic Powder, Apple Cider Vinegar, Ghost Pepper Mash (ghost peppers, distilled vinegar), Smoked Paprika, Ghost Pepper Powder.",43500,1,0,0,0,0,0,0,0,0,0,1,1,0,0,0,0,1,0,0,0,0,0,0,0,0,0,0,0,0,0,0,0,0,0,0,0,0,0,0,0,0,0,0,0,1,0,3
8,Angry Goat Pepper Co. The Phoenix Hot Sauce,Angry Goat Pepper Co.,"Cantaloupe melon, distilled white vinegar, lime juice, yellow Scotch Bonnet mash (peppers, vinegar), orange blossom honey, peaches, sweet onions, olive oil, ginger root, datil pepper powder, salt, garlic powder",39000,1,0,0,0,0,0,0,0,0,0,0,0,0,0,0,0,0,0,0,0,0,1,0,0,0,0,0,0,0,0,0,0,0,0,0,0,0,0,1,0,0,0,0,0,0,0,2
9,Blair's Mega Death Sauce,Blair's,"Red Habanero Pods, Cayenne Chilies, White Vinegar, Natural Pepper Flavor (contains soybean oil) Ancho Chilies, Chipotle Chilies, Molasses, Guava Nectar, Fresh Ginger, Salt, Spices.",550000,3,0,0,0,0,0,0,1,0,0,0,0,0,0,0,0,1,0,0,1,0,0,0,0,0,0,1,0,0,0,0,0,0,0,0,0,0,0,0,0,0,0,0,0,1,1,4
10,Blair's Original Death Sauce with Chipotle,Blair's,"Red Ripe Habaneros, Fiery Cayenne Chilies, Sticky Chipolte, Key Lime Juice, Smashed Garlic.",30000,1,0,0,0,0,0,0,0,0,0,0,0,0,0,0,0,1,0,0,1,0,0,0,0,0,0,1,0,0,0,0,0,0,0,0,0,0,0,0,0,0,0,0,0,1,1,3
11,Bravado Spice Company Aka Miso Ghost-Reaper Hot Sauce,Bravado Spice Company,"Ghost Pepper, Carolina Reaper, Rice Wine Vinegar, Aka Miso, Soy Sauce, Sesame Oil, Togarashi, Salt.",116000,1,0,0,0,1,0,0,0,0,0,0,1,0,0,0,1,0,0,0,0,0,0,0,0,0,0,0,0,0,0,0,0,0,0,0,0,0,0,0,0,0,0,0,0,0,0,3
12,Bravado Spice Company Black Garlic Carolina Reaper Hot Sauce,Bravado Spice Company,"Vinegar, Red Serrano, Carolina Reaper, Roasted Garlic, Maple Syrup, Black Garlic, Black Pepper, Sea Salt .",71000,1,0,0,0,0,0,0,0,0,0,0,0,0,0,0,1,0,0,0,0,0,0,0,0,0,0,0,0,0,0,0,0,0,0,0,0,0,0,0,1,0,0,0,0,0,0,2
13,Bravado Spice Company Ghost Pepper and Blueberry Hot Sauce,Bravado Spice Company,"Blueberry, Raspberry, Distilled Vinegar, Ghost Pepper, Ground Black Pepper, Sea Salt & Xanthan Gum",28000,1,0,0,0,0,0,0,0,0,0,0,1,0,0,0,0,0,0,0,0,0,0,0,0,0,0,0,0,0,0,0,0,0,0,0,0,0,0,0,0,0,0,0,0,0,0,1
14,Brooklyn Delhi Ghost Pepper Hot Sauce,Brooklyn Delhi,"Tomatoes, water, ghost peppers, tomato paste, sunflower oil, sesame oil, garlic, vinegar, spices (including turmeric), salt, tamarind",39000,1,0,0,0,0,0,0,0,0,0,0,1,0,0,0,0,0,0,0,0,0,0,0,0,0,0,0,0,0,0,0,0,0,0,0,0,0,0,0,0,0,0,0,0,0,0,1
15,Bunsters Black Label Hot Sauce,Bunsters,"Orange Juice, Scorpion Peppers, Bird's Eye Peppers, Brown Onions, Garlic, Apple Cider Vinegar, Coconut Sugar, Cilantro, Lime Juice, Ginger, Salt, Goji Berries, Potato Starch, Himalayan Pink Salt.",99000,1,0,0,0,0,0,0,0,0,0,0,0,1,0,0,0,0,0,0,0,0,0,0,0,0,0,0,0,0,0,0,0,0,0,0,0,0,1,0,0,0,0,0,0,0,0,2
16,Burns & McCoy Exhorresco Hot Sauce,Burns & McCoy,"7 Pot Primo Peppers, Oak Aged Apple Cider Vinegar, Agave Nectar, Yuzu Juice, Black Garlic, Salt, Spices.",625000,1,1,0,0,0,0,0,0,0,0,0,0,0,0,0,0,0,0,0,0,0,0,0,0,0,0,0,0,0,0,0,0,0,0,0,0,1,0,0,0,0,0,0,0,0,0,2
17,Burns & McCoy Mezcaline Oaxacan Hot Sauce,Burns & McCoy,"fire roasted tomato (vine ripened tomatoes, tomato juice, salt, citric acid), red jalapeno mash (peppers, vinegar), water, orange habanero mash (peppers, vinegar), garlic, onion, brown sugar, vinegar, mezcal, olive oil, salt, espresso, rose water, lime juice, cocoa powder, oregano, chocolate bhutlah pepper powder, chocolate ghost pepper powder, thyme, cinnamon.",16600,1,0,0,0,0,0,0,0,0,0,0,1,0,0,0,0,0,0,0,0,1,0,0,0,0,0,1,0,1,0,0,0,0,0,0,0,0,0,0,0,0,0,0,0,0,1,4
18,Butterfly Bakery of Vermont Maple Wood Smoked Onion Hot Sauce,Butterfly Bakery of Vermont,"Red jalapeños, organic white vinegar, maple wood smoked onions, salt",7900,1,0,0,0,0,0,0,0,0,0,0,0,0,0,0,0,0,0,0,0,0,0,0,0,0,0,0,0,1,0,0,0,0,0,0,0,0,0,0,0,0,0,0,0,0,0,1
19,Butterfly Bakery of Vermont Taco Vibes Only Hot Sauce,Butterfly Bakery of Vermont,"Organic distilled white vinegar, red serrano, reaper peppers, lime juice, ghost peppers, garlic scapes, salt, reaper pepper powder, coriander, cumin",638000,1,0,0,0,0,0,0,0,0,0,0,1,0,0,0,1,0,0,0,0,0,0,0,0,0,0,0,0,0,0,0,0,0,0,0,0,0,0,0,1,0,0,0,0,0,0,3
20,Cantina Royal Tamaulipeka Hot Sauce,Cantina Royal,"Non-gmo corn oil, chili peppers, tamarind concentrate (tamarind pulp, water, maple sugar), distilled white vinegar reduced to 4% acidity, garlic, celery, onion, salt",4200,1,0,0,0,0,0,0,0,0,0,0,0,0,0,0,0,0,0,1,0,0,0,0,0,0,0,0,0,0,0,0,0,0,0,0,0,0,0,0,0,0,0,0,1,0,0,1
21,Cantina Royal Tomasa Spicy Habanero & Manzano Chile Hot Sauce,Cantina Royal,"non-gmo corn oil, manzano peppers, habanero peppers, garlic, onion, celery, salt.",18000,1,0,0,0,0,0,0,0,0,0,0,0,0,0,0,0,0,0,0,0,0,0,0,0,0,0,1,0,0,0,1,0,0,0,0,0,0,0,0,0,0,0,0,0,0,1,2
22,Chile Lengua De Fuego Bhutila Fire Hot Sauce,Chile Lengua De Fuego,"Smoked scotch bonnet pepper mash (scotch bonnet, white vinegar), bitter orange, jalapeno pepper mash (jalapeno, white vinegar), cilantro, salt, super hot pepper mash (chocolate ghost pepper, zing, Trinidad scorpion, white vinegar), spice, smoked garlic, pepper powder mix (chipotle, scotch bonnet, Trinidad Scorpion)",118000,1,0,0,0,0,0,0,0,0,0,0,1,0,0,0,0,0,0,0,1,1,0,0,0,0,0,0,0,1,0,0,0,0,0,0,0,0,1,1,0,0,0,0,0,0,0,6
23,Chile Lengua De Fuego Turmeric Bomb Hot Sauce,Chile Lengua De Fuego,"Scotch bonnet pepper mash (Scotch bonnet pepper and vinegar), chocolate ghost pepper mash (chocolate bhut jolokia pepper and vinegar), jalapeno pepper mash (jalapeno pepper and vinegar), honduran hard liquor, apple cider vinegar, extra virgin olive oil, ginger root, turmeric, garlic, super hot pepper mash (Carolina Reaper and Trinidad Scorpion peppers and vinegar), spices, salt",69000,1,0,0,0,0,0,0,0,0,0,0,1,0,0,0,1,0,0,0,0,1,0,0,0,0,0,0,0,1,0,0,0,0,0,0,0,0,1,1,0,0,0,0,0,0,0,6
24,Chile Monoloco Pierde Almas Hot Sauce,Chile Monoloco,"Hot peppers, water, lemon, sunflower oil, garlic, herbs, salt, spices",665000,1,0,0,0,0,0,0,0,0,0,0,0,0,0,0,0,0,0,0,0,0,0,0,0,0,0,0,0,0,0,0,0,0,0,0,0,0,0,0,0,0,0,0,0,0,0,0
25,Cholula Original Hot Sauce,Cholula,"Water, Arbol Peppers, Piquin Peppers, Salt, Vinegar, Garlic Powder, Spices and Xanthan Gum",3600,1,0,0,0,0,0,0,0,0,1,0,0,0,0,0,0,0,0,0,0,0,0,0,0,0,0,0,0,0,0,0,0,0,0,0,1,0,0,0,0,0,0,0,0,0,0,2
26,Clark & Hopkins Calabria Hot Sauce,Clark & Hopkins,"Red bell peppers, water, red wine vinegar, garlic, onion, red habanero peppers (red habanero peppers, white vinegar), black olives, sun-dried tomatoes, red jalapeno peppers, diced tomatoes (tomatoes, tomato juice, citric acid, calcium chloride), calabrian chili pepper flakes, raisins, salt, shitake mushroom powder, spices",15700,1,0,0,0,0,0,0,0,0,0,1,0,0,1,0,0,0,0,1,0,0,0,0,0,0,0,1,0,1,0,0,0,0,0,0,0,0,0,0,0,0,0,0,1,0,1,5
27,Clark and Hopkins Assam Hot Sauce,Clark & Hopkins,"apple cider vinegar, tomatoes, onion, garlic, ginger, water, 7 pot primo peppers, ghost peppers, tamarind, black mustard seed, salt, turbinado sugar, spices.",55000,1,1,0,0,0,0,0,0,0,0,0,1,0,0,0,0,0,0,0,0,0,0,0,0,0,0,0,0,0,0,0,0,0,0,0,0,1,0,0,0,0,0,0,0,0,0,3
28,Crystal Hot Sauce,Crystal,"aged red cayenne peppers, distilled white vinegar, and salt",3000,1,0,0,0,0,0,0,0,0,0,0,0,0,0,0,0,1,0,0,0,0,0,0,0,0,0,0,0,0,0,0,0,0,0,0,0,0,0,0,0,0,0,0,0,1,0,1
29,Culley's Fire Water Hot Sauce,Culley's,"Smokin' Ed's Carolina Reaper, Trinidad Scorpion Butch T, Capsicum, White Wine Vinegar, Lime Juice, Mexican Tequila, Palm Sugar, Onions, Ginger, Garlic, Salt, Pepper.",112000,1,0,0,0,0,0,0,0,0,0,0,0,0,0,1,1,0,0,0,0,0,0,0,0,0,0,0,0,0,0,0,0,0,0,0,0,0,1,0,0,0,0,0,0,0,0,3
30,Da' Bomb Beyond Insanity Hot Sauce,Da' Bomb,"Habaneros (habaneros, salt), Chipotle Puree (chipotles, water, salt, citric acid), Water, Orange Juice Concentrate, Natural Pepper Flavoring, Tomato Paste, Potassium Sorbate and Sodium Benzoate ",135600,19,0,0,0,0,0,0,0,0,0,0,0,0,0,0,0,0,0,0,1,0,0,0,0,0,0,1,0,0,0,0,0,0,0,0,0,0,0,0,0,0,0,0,0,0,1,2
31,Dave's Gourmet Insanity Hot Sauce,Dave's Gourmet,"Hot Peppers, Water, Tomato Paste, Hot Pepper Extract, Cane Vinegar, Salt, Onions, Garlic, Citric and Acetic Acids (Acidity Regulators), Xanthan Gum (Thickener), Spices",180000,1,0,0,0,0,0,0,0,0,0,0,0,0,0,0,0,0,0,0,0,0,0,0,0,0,0,0,0,0,0,0,0,0,0,0,0,0,0,0,0,0,0,0,0,0,0,0
32,Dave's Gourmet Temporary Insanity Hot Sauce,Dave's Gourmet,"Hot Peppers, Water, Tomato Paste, Cane Vinegar, Hot Pepper Extract, Salt, Onions, Acetic and Citric Acids (Acidity Regulators), Garlic, Xanthan Gum (Thickener), Spices",57000,1,0,0,0,0,0,0,0,0,0,0,0,0,0,0,0,0,0,0,0,0,0,0,0,0,0,0,0,0,0,0,0,0,0,0,0,0,0,0,0,0,0,0,0,0,0,0
33,Dawson's Cedar Smoked Garlic Hot Sauce,Dawson's,"White wine vinegar, Habanero, Garlic, Onion, Extra virgin olive oil, Sea salt, Sumac",7000,1,0,0,0,0,0,0,0,0,0,0,0,0,0,0,0,0,0,0,0,0,0,0,0,0,0,1,0,0,0,0,0,0,0,0,0,0,0,0,0,0,0,0,0,0,1,1
34,Dawson's Original Hot Sauce,Dawson's,"habanero, vinegar, cane sugar, extra virgin olive oil, garlic, and sea salt",82000,1,0,0,0,0,0,0,0,0,0,0,0,0,0,0,0,0,0,0,0,0,0,0,0,0,0,1,0,0,0,0,0,0,0,0,0,0,0,0,0,0,0,0,0,0,1,1
35,Dawson’s Shawarma Sauce,Dawson's,"Cayenne, vinegar, garlic, extra virgin olive oil, honey, spices, red chili pepper, sea salt, granulated garlic, chili powder",4200,1,0,0,0,0,0,0,0,0,0,0,0,0,0,0,0,1,0,1,0,0,0,0,0,0,0,0,0,0,0,0,0,0,0,0,0,0,0,0,0,0,0,0,1,1,0,2
36,Dingo Sauce Co. Psycho Hot Sauce,Dingo Sauce Co.,"Mustard X Chilli, Cider Vinegar, Garlic, Turmeric, Coriander Seed, Mustard Powder, Cumin Seed, Fennel Seed, Cinnamon Sticks, Ground Mace, Cloves",666000,1,0,0,0,0,0,0,0,0,0,0,0,0,0,0,0,0,0,1,0,0,0,0,0,0,0,0,0,0,0,0,0,0,0,0,0,0,0,0,0,0,0,0,1,0,0,1
37,Dingo Sauce Co. Widow Maker Hot Sauce,Dingo Sauce Co.,"Chilli Peppers, Cider Vinegar, Lime, Garlic, Brown Sugar, Sea Salt",682000,1,0,0,0,0,0,0,0,0,0,0,0,0,0,0,0,0,0,1,0,0,0,0,0,0,0,0,0,0,0,0,0,0,0,0,0,0,0,0,0,0,0,0,1,0,0,1
38,Dirty Dick’s Hot Pepper Sauce With a Tropical Twist,Dingo Sauce Co.,"Habanero Peppers, Mangoes, Pineapple, Vinegar, Bananas, Brown Sugar, Raisins, Onions, Garlic, Salt, Spices",21000,1,0,0,0,0,0,0,0,0,0,0,0,0,0,0,0,0,0,0,0,0,0,0,0,0,0,1,0,0,0,0,0,0,0,0,0,0,0,0,0,0,0,0,0,0,1,1
39,Double Take Salsa Co. Scotch Bonnet Mustard Hot Sauce,Double Take Salsa Co.,"Yellow Deli Mustard (Distilled Vinegar, Water, #1 Grade Mustard Seed, Salt, Turmeric, Paprika, Spice, Natural Flavors, And Garlic Powders), Orange Juice, Lime Juice, Scotch Bonnet Chile Peppers, Brown Sugar (Sugar, Cane Molasses), Spices",37000,1,0,0,0,0,0,0,0,0,0,0,0,0,0,0,0,0,0,1,0,0,0,0,0,0,0,0,0,0,0,0,0,0,0,0,0,0,0,1,0,0,0,0,1,0,0,2
40,El Yucateco Caribbean Hot Sauce,El Yucateco,"Water, Habanero Chile (28%), Carrot, Salt, Spices, Acetic Acid, Onion Powder, Citric Acid, Xanthan Gum, Preservatives (Sodium Benzoate E-211, Potassium Sorbate E-202)",5790,1,0,0,0,0,0,0,0,0,0,0,0,0,0,0,0,0,0,1,0,0,0,0,0,0,0,1,0,0,0,0,0,0,0,0,0,0,0,0,0,0,0,0,1,0,1,2
41,El Yucateco Chile Habanero Hot Sauce,El Yucateco,"Water, Habanero Peppers, Salt, Acetic Acid (Ph Control Agent), Spices, Xanthan Gum (Stabilizer), Citric Acid, Onion Powder, Colored with Turmeric, Fruit Juice and Vegetable Juice, Sodium Benzoate",5790,2,0,0,0,0,0,0,0,0,0,0,0,0,0,0,0,0,0,0,0,0,0,0,0,0,0,1,0,0,0,0,0,0,0,0,0,0,0,0,0,0,0,0,0,0,1,1
42,Fiji Fire Native Bongo Chilli Hot Sauce,Fiji Fire,"Naturally Brewed Vinegar, Fresh Fijian Bongo Chillies (30%), Sweet Carrots, Wild Fijian Turmeric, Tasman Sea Salt",14300,1,0,0,0,0,0,0,0,0,0,0,0,0,0,0,0,0,0,0,0,0,0,0,1,0,0,0,0,0,0,0,0,0,0,0,0,0,0,0,0,0,0,0,0,0,0,1
43,Fly By Jing Sichuan Gold Hot Sauce,Fly By Jing,"Non-GMO soybean oil, non-GMO sichuan rapeseed oil, chili peppers, sichuan peppers, ginger, garlic, rock sugar, star anise, cassia bark, green onions, chili oil extract",46000,1,0,0,0,0,0,0,0,0,0,0,0,0,0,0,0,0,0,1,0,0,0,0,0,0,0,0,0,0,0,0,0,0,0,0,0,0,0,0,0,0,0,0,1,0,0,1
44,Fresno Sauce Company Chipotle & Habanero Hot Sauce,Fresno Sauce Company,"Habanero Peppers, Chipotle Chili Powder, Carrots, Distilled White Vinegar, Olive Oil, Garlic, Salt, Organic Sugar, Black Pepper, Water",12400,1,0,0,0,0,0,0,0,0,0,0,0,0,0,0,0,0,0,1,1,0,0,0,0,0,0,1,0,0,0,0,0,0,0,0,0,0,0,0,0,0,0,0,1,0,1,3
45,Halogi Hot Sauce Tyrfing's Curse Hot Sauce,Halogi Hot Sauce,"Yellow Bell Pepper, Red Onion, White Wine Vinegar, Baby Carrots, Orange Juice, Apple Cider Vinegar, Water, Ghost Peppers, Scorpion Peppers, Habanero Pepper, Garlic, Ginger, Spices, Cayenne Pepper",99000,1,0,0,0,0,0,0,0,0,0,1,1,0,0,0,0,1,0,0,0,0,0,0,0,0,0,1,0,0,0,0,0,0,0,0,0,0,1,0,0,0,0,0,0,1,1,5
46,Heartbeat Hot Sauce Red Habanero Hot Sauce,Heartbeat Hot Sauce,"Bell Pepper, Onion, White Vinegar, Sugar, Red Habanero, Garlic, Lime Juice, Kosher Salt, Canola Oil",4000,1,0,0,0,0,0,0,0,0,0,1,0,0,0,0,0,0,0,0,0,0,0,0,0,0,0,1,0,0,0,0,0,0,0,0,0,0,0,0,0,0,0,0,0,0,1,2
47,Heartbeat Hot Sauce Scorpion Hot Sauce,Heartbeat Hot Sauce,"Vinegar, red peppers, habaneros, beets, onions, garlic, Trinidad Scorpion Peppers, Chipotles in Adobo (red chipotle pepper, water, vinegar, sugar, salt, tomato paste, smoke essence, onion, garlic), salt, lemon juice, canola oil, spices",66000,1,0,1,0,0,0,0,0,0,0,0,0,0,0,0,0,0,0,0,1,0,0,0,0,0,0,1,0,0,0,0,0,0,0,0,0,0,1,0,0,0,0,0,0,0,1,4
48,Heartbeat Pineapple Habanero Hot Sauce,Heartbeat Hot Sauce,"pineapple, yellow peppers, onion, distilled vinegar, Habaneros, organic cane sugar, lime juice, kosher salt, garlic, ale (water, hops, malted barley, yeast)",12200,1,0,0,0,0,0,0,0,0,0,0,0,0,0,0,0,0,0,0,0,0,0,0,0,0,0,1,0,0,0,0,0,0,0,0,0,0,0,0,0,0,0,0,0,0,1,1
49,Hellfire Detroit Bourbon Habanero Ghost Hot Sauce,Hellfire Detroit,"Apple cider vinegar, fire-roasted habanero, water, bourbon, sea salt, lime juice, smoked ghost chili pepper, olive oil, black pepper",89000,1,0,0,0,0,0,0,0,0,0,0,1,0,0,0,0,0,0,1,0,0,0,0,0,0,0,1,0,0,0,0,0,0,0,0,0,0,0,0,0,0,0,0,1,0,1,3
50,Hellfire Detroit Habanero Hot Sauce,Hellfire Detroit,"Fire-roasted Habanero, apple cider vinegar, distilled water, olive oil, sea salt",66000,1,0,0,0,0,0,0,0,0,0,0,0,0,0,0,0,0,0,0,0,0,0,0,0,0,0,1,0,0,0,0,0,0,0,0,0,0,0,0,0,0,0,0,0,0,1,1
51,Hellfire Devil's Blend Hot Sauce,Hellfire Detroit,"Fire Roasted Jalapeño Peppers, Distilled Vinegar, Jalapeño, Hot Cherry, Cayenne, Jolokia, 7-Pot, Moruga Scorpion, Carolina Reaper, Tomatillos, Granny Smith Green Apples, Roasted Garlic, Scallions, Cilantro, Sea Salt, Lime Juice, Cumin",42000,1,1,0,0,0,0,0,0,0,0,0,1,0,0,0,1,1,1,0,0,0,0,0,0,0,0,0,0,1,0,0,0,0,0,0,0,0,1,0,0,0,0,0,0,1,0,7
52,Hellfire Fear This! Hot Sauce,Hellfire Detroit,"Carolina Reaper Peppers, Distilled Vinegar, Garlic, Red Wine Vinegar, Apple Cider Vinegar, Sun-Dried Tomatoes, Onions, Salt, Cilantro, Curry, Chili Powder, Black Pepper, Paprika, Cumin, Lime Juice, Lemon Juice, Coriander, Ginger",679000,1,0,0,0,0,0,0,0,0,0,0,0,0,0,0,1,0,0,1,0,0,0,0,0,0,0,0,0,0,0,0,0,0,0,0,0,0,0,0,0,0,0,0,1,0,0,2
53,Hellfire Fiery Fool Hot Sauce,Hellfire Detroit,"Bhut Jolokia Peppers, Trinidad Scorpion Peppers, Red 7-Pot Peppers, Chocolate Habanero Peppers, Carribean Red Peppers, Carolina Reaper Peppers, Sun-Dried Tomatoes, Garlic, Sea Salt, Cumin, Lemon Juice",550000,1,1,0,0,0,0,0,0,0,0,0,1,0,0,0,1,0,0,0,0,1,0,0,0,0,0,1,0,0,0,0,0,0,0,0,0,0,1,0,0,0,0,0,0,0,1,6
54,Hellfire Hot Sauce Kranked Hot Sauce,Hellfire Detroit,"Reaper pepper mash (Reaper peppers, vinegar), apple cider vinegar, red wine vinegar, black garlic, garlic (garlic, water), sea salt, brown sugar (cane sugar and molasses), chili powder, cumin, onions, black pepper, curry powder (spices, turmeric, salt, contains mustard), oregano, paprika, ginger, cloves, turmeric, lemon juice from concentrate, lime juice from concentrate",699000,1,0,0,0,0,0,0,0,0,0,0,0,0,0,0,1,0,0,1,0,0,0,0,0,0,0,0,0,0,0,0,0,0,0,0,0,0,0,0,0,0,0,0,1,0,0,2
55,High Desert Sauce Co. Tikk-Hot Masala Hot Sauce,High Desert Sauce Co.,"Distilled Vinegar, Roma Tomato, Unsweetened Coconut Milk, Ghost Pepper, Anaheim Chili, Onion, Water, Agave Nectar, Tomato Paste, Carolina Reaper Pepper, Apple Cider Vinegar, Kosher Salt, Fresh Ginger, Fresh Garlic, Toasted Peppercorns, Toasted Cumin Seed, Garam Masala, Turmeric, Coriander",72000,1,0,0,0,0,0,1,0,0,0,0,1,0,0,0,1,0,0,1,0,0,0,0,0,0,0,0,0,0,0,0,0,0,0,0,0,0,0,0,0,0,0,0,1,0,0,4
56,High River Sauces Cheeba Gold Hot Sauce,High River Sauces,"Peaches, yellow scotch bonnet pepper, onions, distilled vinegar, fatalli peppers, water, brown sugar, mustard, garlic, lemon juice, curry powder, salt, cumin, black pepper, cilantro, family secret spices",25300,1,0,0,0,0,0,0,0,0,0,0,0,0,0,0,0,0,0,0,0,0,0,1,0,0,0,0,0,0,0,0,0,0,0,0,0,0,0,1,0,0,0,0,0,0,0,2
57,High River Sauces Rogue Hot Sauce,High River Sauces,"Moruga Scorpion Peppers, Jolokia Peppers, Red Serrano Peppers, Blood Oranges, Apples, Pears, Apple Cider Vinegar, Brown Sugar, Lime Juice, Garlic and Ginger",34000,1,0,0,0,0,0,0,0,0,0,0,1,0,0,0,0,0,0,0,0,0,0,0,0,0,0,0,0,0,0,0,0,0,0,0,0,0,1,0,1,0,0,0,0,0,0,3
58,High River Sauces Tears of the Sun Private Reserve Hot Sauce,High River Sauces,"Peach Ghost Scorpion pepper mash (Peach Ghost Scorpion peppers, vinegar), apple cider vinegar, mangos, papaya, orange habanero mash (orange habanero peppers, salt), peaches (peaches, water, natural flavor, sugar), pineapple (pineapple, pineapple juice), water, light brown sugar (cane sugar and molasses), lime juice, ginger root, salt, garlic, crushed red pepper",69000,1,0,0,0,0,0,0,0,0,0,0,1,0,0,0,0,0,0,0,0,0,0,0,0,0,0,1,0,0,0,0,0,1,0,0,0,0,1,0,0,0,0,0,0,0,1,4
59,Hoff & Pepper Hoff's House Sauce Hot Sauce,Hoff & Pepper,"Red Jalapeño, Habanero, Chipotle, Salt, Vinegar, Garlic",14500,1,0,0,0,0,0,0,0,0,0,0,0,0,0,0,0,0,0,0,1,0,0,0,0,0,0,1,0,1,0,0,0,0,0,0,0,0,0,0,0,0,0,0,0,0,1,3
60,Hot Heads Official Revolutionary Hot Sauce,Hot Heads,"fire roasted bell pepper, apple cider vinegar, sweet onion, Trinidad scorpion pepper, red bell pepper, tomato paste, garlic, olive oil, sugar, blue agave, pink Himalayan sea salt, Sichuan & pink peppercorns, and lime juice",57000,1,0,0,0,0,0,0,0,0,0,1,0,0,0,0,0,0,0,0,0,0,0,0,0,0,0,0,0,0,0,0,0,0,0,0,0,0,1,0,0,0,0,0,0,0,0,2
61,Hot N Saucy Collards N Ghost Hot Sauce,Hot N Saucy,"Collard greens, ghost peppers, extra virgin olive oil, onion, apple cider vinegar, garlic, brown sugar, salt, water",70000,1,0,0,0,0,0,0,0,0,0,0,1,0,0,0,0,0,0,0,0,0,0,0,0,0,0,0,0,0,0,0,0,0,0,0,0,0,0,0,0,0,0,0,0,0,0,1
62,Hot N Saucy Garlic N Pepperoncini Hot Sauce,Hot N Saucy,"Pepperoncini, water, salt, vinegar, citric acid, cilantro, honey, sugar, and garlic",3900,1,0,0,0,0,0,0,0,0,0,0,0,0,0,0,0,0,0,0,0,0,0,0,0,0,0,0,0,0,0,0,0,0,1,0,0,0,0,0,0,0,0,0,0,0,0,1
63,Hot Ones Eye of the Scorpion Hot Sauce,Hot Ones,"Scorpion peppers, vinegar, canola oil, garlic, salt, and scorpion pepper powder",676000,1,0,0,0,0,0,0,0,0,0,0,0,0,0,0,0,0,0,0,0,0,0,0,0,0,0,0,0,0,0,0,0,0,0,0,0,0,1,0,0,0,0,0,0,0,0,1
64,Hot Ones Fiery Chipotle Hot Sauce,Hot Ones,"Pineapple, Chipotle Peppers, Habanero, Carrot, Vinegar, Sugar, Curry Paste, Tomato Paste,Salt, Lime Juice, Ghost Pepper (dried)",15600,4,0,0,0,0,0,0,0,0,0,0,1,0,0,0,0,0,0,0,1,0,0,0,0,0,0,1,0,0,0,0,0,0,0,0,0,0,0,0,0,0,0,0,0,0,1,3
65,Hot Ones Los Calientes Barbacoa Hot Sauce,Hot Ones,"applewood smoked red jalapeno, chipotle, habanero, lime juice, agave nectar, apricot (ascorbic acid added), apple cider vinegar, apple juice, tomatillo, salt, roast garlic, garlic, onion, culantro, cumin, black pepper, celery seed",33000,2,0,0,0,0,0,0,0,0,0,0,0,0,0,0,0,0,0,0,1,0,0,0,0,0,0,1,0,1,0,0,0,0,0,0,0,0,0,0,0,0,0,0,0,0,1,3
66,Hot Ones Los Calientes Hot Sauce,Hot Ones,"green serrano, applewood smoked, green serrano, orange habanero, apple cider, apricot (ascorbic acid added), apple cider vinegar, lemon juice, tomatillo, agave nectar, water, garlic, salt, toasted onion, cumin, culantro, black pepper, celery seed",36000,5,0,0,0,0,0,0,0,0,0,0,0,0,0,0,0,0,0,0,0,0,0,0,0,0,0,1,0,0,0,0,0,0,0,0,0,0,0,0,1,0,0,0,0,0,1,2
67,Hot Ones Los Calientes Rojo Hot Sauce,Hot Ones,"smoked red jalapeno, habanero, apricot (ascorbic acid added), apple cider vinegar, agave nectar, lemon juice, tomatillo, water, garlic, salt, toasted onion, cumin, cilantro, black pepper, thyme, celery seed",49000,5,0,0,0,0,0,0,0,0,0,0,0,0,0,0,0,0,0,0,0,0,0,0,0,0,0,1,0,1,0,0,0,0,0,0,0,0,0,0,0,0,0,0,0,0,1,2
68,Hot Ones Los Calientes Verde Hot Sauce,Hot Ones,"Green Serrano, Applewood Smoked Green Serrano, Orange Habanero, Apple Cider, Apricot, Apple Cider Vinegar, Lemon Juice, Tomatillo, Agave Nectar, Water, Garlic, Salt, Roasted Onion, Cumin, Coriander, Black Pepper, Celery seed",36000,3,0,0,0,0,0,0,0,0,0,0,0,0,0,0,0,0,0,0,0,0,0,0,0,0,0,1,0,0,0,0,0,0,0,0,0,0,0,0,1,0,0,0,0,0,1,2
69,Hot Ones The Classic Chilli Maple Hot Sauce,Hot Ones,"Chili peppers, maple syrup, cider vinegar, vinegar, garlic, garlic powder, salt, black pepper, turmeric",1800,2,0,0,0,0,0,0,0,0,0,0,0,0,0,0,0,0,0,1,0,0,0,0,0,0,0,0,0,0,0,0,0,0,0,0,0,0,0,0,0,0,0,0,1,0,0,1
70,Hot Ones The Classic Garlic Fresno Hot Sauce,Hot Ones,"fresno chilli pepper, water, apple cider vinegar, garlic puree (garlic and water), vinegar, kosher salt, organic dried garlic, organic turmeric, organic black pepper",1700,3,0,0,0,0,0,0,0,0,0,0,0,0,0,0,0,0,0,1,0,0,0,0,0,1,0,0,0,0,0,0,0,0,0,0,0,0,0,0,0,0,0,0,1,0,0,2
71,Hot Ones The Classic Hot Sauce,Hot Ones,"Organic chile de arbol peppers, organic apple cider vinegar, organic vinegar, water, organic garlic, kosher salt, organic turmeric",1800,9,0,0,0,0,0,0,0,0,1,0,0,0,0,0,0,0,0,1,0,0,0,0,0,0,0,0,0,0,0,0,0,0,0,0,0,0,0,0,0,0,0,0,1,0,0,2
72,Hot Ones The Last Dab Apollo Hot Sauce,Hot Ones,"The Apollo Pepper, distilled vinegar, The Apollo Pepper powder, The Apollo Pepper distillate",2000000,8,0,0,0,0,0,0,0,1,0,0,0,0,0,0,0,0,0,0,0,0,0,0,0,0,0,0,0,0,0,0,0,0,0,0,0,0,0,0,0,0,0,0,0,0,0,1
73,Hot Ones The Last Dab Hot Sauce,Hot Ones,"PepperX, chocolate pepper X, peach pepper X, distilled vinegar, ginger root, turmeric, coriander, cumin, dry mustard",1000000,2,0,0,0,0,0,0,0,0,0,0,0,0,0,0,0,0,0,0,0,1,0,0,0,0,0,0,0,0,0,0,0,1,0,1,0,0,0,0,0,0,0,0,0,0,0,3
74,Hot Ones The Last Dab Reduxx,Hot Ones,"PepperX, Chocolate Pepper X, distilled vinegar, ginger root, turmeric, coriander, cumin, dry mustard",2000000,4,0,0,0,0,0,0,0,0,0,0,0,0,0,0,0,0,0,0,0,1,0,0,0,0,0,0,0,0,0,0,0,0,0,1,0,0,0,0,0,0,0,0,0,0,0,2
75,Hot Ones The Last Dab XXX Hot Sauce,Hot Ones,"PepperX, chocolate pepper X, peach pepper X, distilled vinegar, ginger root, turmeric, coriander, cumin, dry mustard",2000000,3,0,0,0,0,0,0,0,0,0,0,0,0,0,0,0,0,0,0,0,1,0,0,0,0,0,0,0,0,0,0,0,1,0,1,0,0,0,0,0,0,0,0,0,0,0,3
76,Hotter Than El Ghost Sauce,Hotter Than El,"distilled vinegar, diced tomatoes (tomatoes, tomato juice, salt), carrots, onions, garlic, ghost peppers, salt",39000,1,0,0,0,0,0,0,0,0,0,0,1,0,0,0,0,0,0,0,0,0,0,0,0,0,0,0,0,0,0,0,0,0,0,0,0,0,0,0,0,0,0,0,0,0,0,1
77,Hotter Than El Love Burns Hot Sauce,Hotter Than El,"Red 7 Pot Primo pepper mash (Red 7 Pot Primo Peppers and vinegar), Reaper pepper mash (Reaper peppers, vinegar), Trinidad Scorpion pepper mash (Trinidad Scorpion Peppers, salt), lime juice, carrots, onions, apple cider vinegar, water, garlic, carrot concentrate, ghost chile powder",101000,1,1,0,0,0,0,0,0,0,0,0,1,0,0,0,1,0,0,1,0,0,0,0,0,0,0,0,0,0,0,0,0,0,0,0,0,1,1,0,0,0,0,0,1,0,0,6
